Company,Description,Country,Website
Airbnb,Platform for booking unique stays and local experiences,USA,https://www.airbnb.com
TripAdvisor,Travel reviews and destination guides,USA,https://www.tripadvisor.com
Expedia,Online travel booking for flights hotels and packages,USA,https://www.expedia.com
MakeMyTrip,Indian travel booking and holiday packages,India,https://www.makemytrip.com
Goibibo,Online hotel and bus booking platform,India,https://www.goibibo.com
Lonely Planet,Travel guide publisher and city explorer app,Australia,https://www.lonelyplanet.com
Google Travel,AI powered travel planner with maps and itinerary suggestions,USA,https://www.google.com/travel
